trade_range_modifier,trade_range_modifier = 0.25,Modifies the trade range used to determine if a country can place a merchant in a tradenode.,Multiplicative,1.1
trade_steering,trade_steering = 0.1,"Modifies the bonus to trade power used for steering when determining which outgoing node trade is steered to. If you have a merchant present, it also slightly increases the outgoing value.",Multiplicative,1.1
global_ship_trade_power,global_ship_trade_power = 0.2,Modifies the trade power ships grant when protecting trade.,Multiplicative,1.16
privateer_efficiency,privateer_efficiency = 0.2,Modifies the effectiveness of privateers in a tradenode.,Multiplicative,1.6
embargo_efficiency,embargo_efficiency = 0.25,Modifies the effectiveness of embargoing another country.,Multiplicative,1.1
ship_power_propagation,ship_power_propagation = 0.1,Modifies the propagation of trade power from ships protecting trade.,Multiplicative,1.2